{"$schema":"http://json-schema.org/draft-07/schema#","title":"work-item.v1","type":"object","additionalProperties":false,"required":["schema","work_id","node_gid","source_commit","pipeline_version","eligibility","selection","created_at"],"properties":{"schema":{"const":"work-item.v1"},"work_id":{"type":"string","pattern":"^[0-9a-f]{64}$"},"node_gid":{"type":"string"},"source_commit":{"type":"string","pattern":"^[0-9a-f]{40}$"},"pipeline_version":{"type":"string"},"eligibility":{"type":"object","additionalProperties":false,"required":["state","deps_all_closed"],"properties":{"state":{"const":"Open"},"deps_all_closed":{"const":true}}},"selection":{"type":"object","additionalProperties":false,"required":["tie_break","runner_up"],"properties":{"tie_break":{"type":"object","additionalProperties":false,"required":["unlocks","depth","gid"],"properties":{"unlocks":{"type":"integer","minimum":0},"depth":{"type":"integer","minimum":0},"gid":{"type":"string"}}},"runner_up":{"anyOf":[{"type":"string"},{"type":"null"}]}}},"created_at":{"type":"string","pattern":"^\\d{4}-\\d{2}-\\d{2}T[^ ]+Z$","format":"date-time"}}}
