{"schema":"work-item.v1","work_id":"a010e04a938f40e5c8c8e1a82a6df1c64f099e8de22b045c8a97afcf6505c972","node_gid":"n1","source_commit":"bbbbbbbbbbbbbbbbbbbbbbbbbbbbbbbbbbbbbbbb","pipeline_version":"p1","eligibility":{"state":"Open","deps_all_closed":true},"selection":{"tie_break":{"unlocks":1,"depth":0,"gid":"n1"},"runner_up":null},"created_at":"2026-01-01T00:00:00Z"}
